Id,Content
Zuoyequnxing_1_1,What are you looking at?
Zuoyequnxing_1_2,"Ah, there you are. Nothing really. I've just been wondering... if I wanted to land another astronomical investment to study all the Exoswarm coming off this giant mech..."
Zuoyequnxing_1_3,"What kind of pitch would it take to make every major player in Solaris nod along and funnel Credits into my pocket, year after year?"
Zuoyequnxing_1_4,Have you figured it out?
Zuoyequnxing_1_5,"Not yet. My conscience won't let me think that far. Luckily, the man who can figure it out is back."
Zuoyequnxing_1_6,...The old man who promised me the blade? The head of the Spacetrek Collective?
Zuoyequnxing_1_7,"The very same, but don't let the quick agreement fool you. He's already thinking ten steps ahead. If Ashinohara wasn't in such dire straits, he wouldn't have agreed to forge that blade for you so easily."
Zuoyequnxing_1_8,"Or at the very least, he'd have made sure he got his pound of flesh in return."
Zuoyequnxing_1_14,Take two. Give yourself a day to look around.
Zuoyequnxing_1_15,Go on. A Black Shores member will meet you there. Hmph... I still have all of Dr. Luuk's mess to clean up.
Zuoyequnxing_1_16,Understood. I am at your call should you require it.
Zuoyequnxing_1_17,"Yes, I'm listening..."
Zuoyequnxing_1_18,So it's about Denia... I see. Let's discuss it in person.
Zuoyequnxing_1_19,...I couldn't find the child. Time and space in that dimension are too fractured. My familiar lost its way.
Zuoyequnxing_1_20,Hm... then we need something that can hold out longer. A better way to search?
Zuoyequnxing_1_21,Voidmatter reactivity has been high lately. A clear sign to follow would be best.
Zuoyequnxing_1_22,That child is the Exostrider's Resonator. There's no clearer sign than that.
Zuoyequnxing_1_23,"Looks like it's time the Exostrider was reactivated. When that happens, whether you're an annoying adult or the one meant to pilot it, I'm sure everyone will be on board, don't you think?"
Zuoyequnxing_1_24,"Ooh, what if we used footage of the Exostrider activating to pitch for funding?"
Zuoyequnxing_1_25,And the confidentiality agreements?
Zuoyequnxing_1_26,No sympathy for my chronic funding anxiety?
Zuoyequnxing_1_27,Fine. Go to Honami. I already approved your leave of absence.
Zuoyequnxing_1_28,Why?
Zuoyequnxing_1_29,To... test the blade?
Zuoyequnxing_1_30,"Even once the Exostrider awakens, there's still a chance it fails. If it does, what you sealed in the <te href=851075>Dimmr Plains</te> becomes a liability..."
Zuoyequnxing_1_31,But it could also be our ace in the hole.
Zuoyequnxing_1_32,"So before I give you the thankless task of guarding those plains, go deal with matters of the heart first."
Zuoyequnxing_1_33,...Understood. I will return in one day.
Zuoyequnxing_1_34,"Hiyuki arrives at the frostlands to inform Lucilla that her origami familiar failed to locate Aemeath. Lucilla assigns Hiyuki the new task of guarding the Dimmr Plains while they carry on with their plan to awaken the Exostrider, a contingency if the plan fails. To help Hiyuki fulfill that duty with a clear mind, Lucilla suggests she first return to Honami City to deal with certain matters of the heart."
Zuoyequnxing_10_1,"Hello, Lady Miko. I've been waiting for you for a very long time."
Zuoyequnxing_10_2,My final wish… was simply to see you one last time.
Zuoyequnxing_10_3,...Your final wish?
Zuoyequnxing_10_4,"Yes. It's alright. I know I'm dead. I know I'm what they call a ""Left Behind"" now."
Zuoyequnxing_10_5,"But I thought if I'm going to remain like this anyway, I may as well get what I wanted before I disappear, right?"
Zuoyequnxing_10_6,"I've heard of cases where the Left Behind remain aware of their state, sustained by powerful desires… But for such a simple wish…"
Zuoyequnxing_10_7,You truly only wished to see me again?
Zuoyequnxing_10_8,"Hehe. I mean, you <i>are</i> a legend. You've been the Miko of Flaming Sakura since my great-grandmother's time."
Zuoyequnxing_10_9,"When I heard Honami was in danger and that the Miko of Flaming Sakura would meet the vanguard, I rushed here just to see you."
Zuoyequnxing_10_10,"You shouldn't have taken such a risk. If you wished to see me, you could have gone to the Flaming Sakura."
Zuoyequnxing_10_11,"I know, I know. Everyone says you can just write your wish on the plaque and Lady Miko will see it… but I worried. What if it never reached you?"
Zuoyequnxing_10_12,So I came all this way to make the wish in person. I wanted to see whether it would come true.
Zuoyequnxing_10_13,"Very well. Then tell me, what is your true wish?"
Zuoyequnxing_10_14,I wish for world peace. For people to stop living in fear of the Lament. I want everyone to survive it—
Zuoyequnxing_10_15,"Lady Miko, my wish is... ""That there will never be another Miko of Flaming Sakura."""
Zuoyequnxing_10_16,...
Zuoyequnxing_10_17,I see. Then I promise you. This wish will be fulfilled.
Zuoyequnxing_10_18,I know it will.
Zuoyequnxing_10_19,"After all, you <i>are</i> the Eternal Miko—"
Zuoyequnxing_10_20,"Now, now. No need for that, Lady Miko."
Zuoyequnxing_10_21,"If you wished, you could cut down this avatar at any moment. But… I think you'll find this far more interesting."
Zuoyequnxing_10_22,Gyokuro's <ano=white bird>Shiratori</ano>.
Zuoyequnxing_10_23,I know the Fractsidus has caused Ashinohara its fair share of grief. But personally? I hold no ill will toward you.
Zuoyequnxing_10_24,"I had dealings with the previous miko. It wasn't exactly a pleasant chat, but I promise you, her death was not by my hand."
Zuoyequnxing_10_25,"Just as you once witnessed, she met the fate all Mikos of Flaming Sakura share. She died burning her future to ash to pay for the present."
Zuoyequnxing_10_26,Aren't you even a little curious? About what I showed her?
Zuoyequnxing_10_27,"If this makes you uncomfortable, feel free to cut through space and leave. This face of mine, of course, is entirely at your mercy."
Zuoyequnxing_10_28,No need to dull my blade.
Zuoyequnxing_10_29,"Hmph... She wears the exact same expression as the previous miko. I suppose one day, she too will be reduced to ashes by her own wish."
Zuoyequnxing_10_30,"Oh, Eternal Miko... is she simply arrogant? Or just a coward?"
Zuoyequnxing_10_31,"The Grand Architect, disguised as a lively Left Behind, mentions her wish ""That there will never be another Miko of Flaming Sakura"" to Hiyuki before dropping the act. 
In the confrontation, the Grand Architect reveals how Gyokuro burned through all her futures on the path to becoming miko, and that she herself had made contact with Gyokuro in the past. To uncover the truth, Hiyuki steps through a portal."
Zuoyequnxing_11_1,(A peaceful Honami... Why bother with such an illusion?)
Zuoyequnxing_12_1,"Ugh, I'm late for school again..."
Zuoyequnxing_13_1,"Hey, think I can take tomorrow off? If work is the root of all of your problems, why work in the first place?"
Zuoyequnxing_13_2,"Come on. If work is your biggest problem, then you're probably already living a pretty good life."
Zuoyequnxing_14_1,"(If Ashinohara could truly be this peaceful, if their dreams could really come true… then I wouldn't have to raise my blade ever again…)"
Zuoyequnxing_15_1,Superhero movies these days are so boring. They should've just blown up all of Solaris! That would've been a real movie.
Zuoyequnxing_15_2,"Man, just being able to have a normal, peaceful day like this is all we need."
Zuoyequnxing_16_1,"Hmm, guess I'll go draw a fortune stick. Hopefully, I'll get lucky with men soon."
Zuoyequnxing_17_1,Gyokuro...?
Zuoyequnxing_18_1,"Lady Gyokuro, guess what? No math homework today!"
Zuoyequnxing_18_2,My parents and my big sister finally taught me how to make red bean pudding. Want to try mine?
Zuoyequnxing_18_3,"I'd love to! You know I can't resist red bean pudding. Wouldn't miss your special batch for the world, little Kanna."
Zuoyequnxing_18_4,Yay! I'll go make it right now—
Zuoyequnxing_18_5,"<ano=Older sister>Aneue</ano>, I'm here. What is it?"
Zuoyequnxing_18_6,"My, my. Can't a sister just want to see her favorite girl without a reason?"
Zuoyequnxing_18_7,...That's not what I meant.
Zuoyequnxing_18_8,Hehe. There's that serious little face. I just wanted to chat. Always relaxes me.
Zuoyequnxing_18_9,So? How are things at the Flaming Sakura?
Zuoyequnxing_18_10,The usual. Many came to make wishes.
Zuoyequnxing_18_11,The Threnodian's active cycle is almost here. Death will be a frequent visitor to Ashinohara once more.
Zuoyequnxing_18_12,"Prayers for safety, peace, victory… they pile up thickest at times like this."
Zuoyequnxing_18_13,"The Miko of Flaming Sakura is the bridge between people and the divine. A ""wish jar"" for all their hopes. We must listen to every single one."
Zuoyequnxing_18_14,"...Lately, I've been hearing you ring the <ano=ritual bell>Suzu</ano>."
Zuoyequnxing_18_15,"To grant those wishes, you burn your future using the Suzu's power. Continue... and one day there'll be nothing left to burn."
Zuoyequnxing_18_16,"You should have stepped down already, <ano=older sister>Aneue</ano>. Let me become the Miko of Flaming Sakura. Let me inherit the Suzu."
Zuoyequnxing_18_17,"Oh, I'm perfectly fine! I've got futures to spare, you know?"
Zuoyequnxing_18_18,"You tell me, little Hiyuki. What's got you so fixated on this? Don't tell me you're secretly in awe watching my heroics on the battlefield, and—"
Zuoyequnxing_18_19,Yes. I want to be just like you.
Zuoyequnxing_18_20,"Heh... you wish! You're a hundred years too early for that, you little blockhead."
Zuoyequnxing_18_21,Enough about the Suzu! Stay and have some pudding with me instead. I know a wonderful little shop.
Zuoyequnxing_18_22,Always practicing archery under that sakura tree. What a bore! A girl your age should be out living a little!
Zuoyequnxing_18_23,...Here we go again. You know I don't care about any of that.
Zuoyequnxing_18_24,I'm going back.
Zuoyequnxing_18_25,"You sure? Come on, consider granting your big sister's wish."
Zuoyequnxing_18_26,I only came because you called. I put my work on hold. I can't stay too long.
Zuoyequnxing_18_27,Besides... I don't like red bean pudding.
Zuoyequnxing_18_28,Huh?! I keep forgetting you have the world's most boring palate. What a shame.
Zuoyequnxing_18_29,"I'll just have to enjoy it all by my lonesome, then!"
Zuoyequnxing_18_30,Gyokuro never once spoke of her own wishes. She lived only to grant the wishes of others.
Zuoyequnxing_18_31,If only... I had chosen to go with her.
Zuoyequnxing_18_32,"An illusory Honami lies on the other side of the portal. Hiyuki is shown past conversations between Gyokuro and herself. Back then, Hiyuki was timid and reserved, while Gyokuro always embraced her with a smile. Focused on the duty of inheriting her older sister's role as miko and the ability to wield the ""Suzu,"" the past Hiyuki rejected Gyokuro's wish to share red bean pudding with her and returned home alone.
Now, regret lingers in Hiyuki's heart: If only she had chosen to stay with her sister."
Zuoyequnxing_19_1,(...I should go there. One more look will be enough…)
Zuoyequnxing_2_1,"Lady Miko, can you hear me?"
Zuoyequnxing_2_2,Yes. You may call me Hiyuki.
Zuoyequnxing_2_3,"Understood, Lady Hiyuki."
Zuoyequnxing_2_4,...Mmm.
Zuoyequnxing_2_5,"Most of the Left Behind in Honami City have been relocated. But a few, the ones whose regrets run deepest, still roam the danger zones."
Zuoyequnxing_2_6,Their unfulfilled desires concentrate the Lament's power. An incident just waiting to happen.
Zuoyequnxing_2_7,"With you here, I feel better about the situation. We didn't expect you to take this on yourself..."
Zuoyequnxing_2_8,Protecting Honami is the duty of the Miko of Flaming Sakura. I thank you for your support.
Zuoyequnxing_2_9,"Actually, I have a favor to ask."
Zuoyequnxing_2_10,"Oh, is it about Gyokuro, the former miko? We've already found traces that may belong to her, but nothing we can confirm yet."
Zuoyequnxing_2_11,"We're in the process of narrowing down her location. As soon as we learn anything, you'll be the first to know."
Zuoyequnxing_2_12,I am in your debt.
Zuoyequnxing_2_13,"Oh, it's nothing. If it weren't for you back then, I would have... Anyway, I'll leave this area to you!"
Zuoyequnxing_2_14,You can rely on me.
Zuoyequnxing_2_15,…Was there something else you wanted to say?
Zuoyequnxing_2_16,"...N-Nothing! Lady Hiyuki, it's just... Ugh, thank you for everything you do! Goodbye!"
Zuoyequnxing_2_17,"Hiyuki arrives in Honami and makes contact with a Black Shores agent to be briefed on the current situation before handling the deep-rooted obsessions of the Left Behind. The agent mentions that the exact whereabouts of Gyokuro, the former miko, remain unknown."
Zuoyequnxing_3_1,(This blade... It's as sharp as they promised.)
Zuoyequnxing_3_2,"(Once business in Lahai-Roi is settled, I'll take it back to Ashinohara.)"
Zuoyequnxing_4_1,You... You are...!
Zuoyequnxing_4_2,Yes.
Zuoyequnxing_4_3,"Miko of Flaming Sakura, you're back! I knew those monsters wouldn't stand a chance!"
Zuoyequnxing_4_4,"Everyone else thought we were done for, but I told them, ""Don't worry. Lady Miko will come and save us!"""
Zuoyequnxing_4_5,...I'm sorry. I was too late.
Zuoyequnxing_4_6,"It doesn't matter! You're here now, aren't you?"
Zuoyequnxing_4_7,"Please, just say it. Say the Miko of Flaming Sakura has returned, and that those monsters are finished…!"
Zuoyequnxing_4_8,"The Threnodian has retreated, but I couldn't... I couldn't save you..."
Zuoyequnxing_4_9,"But you defeated it. Again. And one day, you'll drive it away from Ashinohara for good!"
Zuoyequnxing_4_10,"Yes, I hear your wish. And I promise, one day..."
Zuoyequnxing_4_11,Purge the Left Behind.
Zuoyequnxing_4_12,"A young, excited Left Behind reminisces about his admiration and dependence on the Miko of Flaming Sakura's salvation."
Zuoyequnxing_5_1,(I... failed their hopes.)
Zuoyequnxing_5_2,"(No matter how many times we drive it back, the Threnodian always returns.)"
Zuoyequnxing_5_3,"(When will we be freed from this nightmare, Ashinohara…?)"
Zuoyequnxing_6_1,"This is all your fault! ""Eternal Miko,"" huh? …You're all useless! Every last one of you!"
Zuoyequnxing_6_2,...
Zuoyequnxing_6_3,How do you even dare show your face in Honami…!
Zuoyequnxing_6_4,They're dead! Everyone's dead! Hahaha… I knew it. I knew the Threnodian couldn't be defeated… I should've run away as far as I could…
Zuoyequnxing_6_5,Lady Miko... Lady Miko! Please! Do something! Anything?
Zuoyequnxing_6_6,I...
Zuoyequnxing_6_7,"...I knew you couldn't hold the line. I knew it couldn't be killed, but... how do we go on from here?"
Zuoyequnxing_6_8,Powerful people like you won't die even if you lose. What about us? What about ordinary people? Just wait to be torn apart?
Zuoyequnxing_6_9,"Lady Miko... Heroes...! Tell me, what should we do?!"
Zuoyequnxing_6_10,"If you need someone to hate, let it be me."
Zuoyequnxing_6_11,"It's alright. Place all your pain, all your resentment upon me. May your soul be granted a moment of peace."
Zuoyequnxing_6_12,Purge the Left Behind.
Zuoyequnxing_6_13,A sorrowful Left Behind spits bitter accusations at the Miko of Flaming Sakura's failure to protect the city.
Zuoyequnxing_7_1,(If I had been stronger… could I have saved them?)
Zuoyequnxing_7_2,(If only I had more power...)
Zuoyequnxing_8_1,Lady Miko... Are you the Lady Miko?
Zuoyequnxing_8_2,Oh! You are! You're the miko who once talked to Lady Gyokuro!
Zuoyequnxing_8_3,"She told me about you. She said you're her most treasured family, just like my big sister and I! Your name is... um, it's..."
Zuoyequnxing_8_4,Hiyuki.
Zuoyequnxing_8_5,"Yes! Hiyuki, that's it! Such a pretty name, just like Lady Gyokuro's!"
Zuoyequnxing_8_6,"My sister said if I hid here and prayed with all my heart, Lady Miko would come and save us. So… I've been waiting."
Zuoyequnxing_8_7,"Little one, what's your name? Your hands are cold. Have you been waiting long?"
Zuoyequnxing_8_8,Kanna. My sister calls me Kanna.
Zuoyequnxing_8_9,"Lady Miko... you're finally here, but my sister... She..."
Zuoyequnxing_8_10,It's alright. I'm listening.
Zuoyequnxing_8_11,"She asked you to wait here, didn't she? She must have trusted you very much to give you such an important task."
Zuoyequnxing_8_12,A... task?
Zuoyequnxing_8_13,"Yes, a task. If not for you, I would never have found this place."
Zuoyequnxing_8_14,"You did well, Kanna. You completed your task perfectly."
Zuoyequnxing_8_15,"Lady Miko, are you here to save Honami? Then… is Honami safe now?"
Zuoyequnxing_8_16,"…Mm, Honami will be fine."
Zuoyequnxing_8_17,Sister said you carry everyone's wishes. That you're the strongest! I knew you'd come and fix everything!
Zuoyequnxing_8_18,"Um… Lady Miko, can you help me find my sister?"
Zuoyequnxing_8_19,Of course. We'll both get to see our sisters again soon.
Zuoyequnxing_8_20,Purge the Left Behind.
Zuoyequnxing_8_21,"When we find her, let's eat red bean pudding! We make the best red bean pudding in the whole world! If you come try it, everyone will want some!"
Zuoyequnxing_8_22,Then you'll need to make a lot of it. Can you manage that?
Zuoyequnxing_8_23,Pinky promise! We'll make lots and lots of pudding!
Zuoyequnxing_8_24,"Then even if the Threnodian comes back, we'll have something to eat, and we won't be scared anymore!"
Zuoyequnxing_8_25,It's a promise then. We'll make a lot of pudding.
Zuoyequnxing_8_26,...
Zuoyequnxing_8_27,"While purifying the Left Behind, Hiyuki encounters a little girl named Kanna, a girl she once knew who crossed paths with both her and her older sister, Miko Gyokuro. Kanna has long since passed away, and like Hiyuki, she too lost a sister. 
To comfort her, Hiyuki promises to make delicious red bean pudding together. Kanna slowly dissipates before her eyes. Hiyuki watches in silence, the memories of the past lingering in the quiet."
Zuoyequnxing_9_1,(Red bean pudding... Gyokuro always did have a weakness for sweets like that.)
Zuoyequnxing_9_2,(This time... will I find her traces and truly set her free?)
Zuoyequnxing_21036_1,"Today's the anniversary of Threnodian's defeat, so we're getting off early. Dinner?"
Zuoyequnxing_21036_2,"I need to pick up some Miko of Flaming Sakura merch. Plus a commemorative booklet. You know, for the little one at home."
Zuoyequnxing_21036_3,"Oh, please. We both know it's for yourself."
Zuoyequnxing_21037_1,Ugh... that's so bitter. How do you even drink this?
Zuoyequnxing_21037_2,Excuse you! The tea you drink is way worse. These are imported coffee beans!
Zuoyequnxing_21037_3,"Oh ho, so she's been hiding the good tea, has she? She just ordered two tins of top-grade gyokuro."
Zuoyequnxing_21037_4,"Hey, hey, don't! I was saving that for her birthday..."
Zuoyequnxing_21038_1,"So, how's that new manga? I'm kind of burnt out on all the ""fighting Threnodian"" stuff."
Zuoyequnxing_21038_2,"I still like it. I mean, it's not like Threnodian's a solved problem in real life, right?"
Zuoyequnxing_21038_3,"I know, I know. We get to take it easy 'cause the mikos are the ones carrying the weight for us."
Zuoyequnxing_21038_4,Hm... maybe there shouldn't be too many stories like that. People might start thinking it's easy.
Zuoyequnxing_21039_1,I saw the Lady Miko with my own eyes...
Zuoyequnxing_21040_1,"Just yesterday, I saw the Lady Miko of Flaming Sakura with my own eyes!"
Zuoyequnxing_21040_2,Flawless white hair. Sharp red eyes. And that sword—except it was only an empty scabbard!
Zuoyequnxing_21040_3,"They say she once broke off a Sakura branch from the roadside, turned it into a divine blade, and beat back the Threnodian with it!"
Zuoyequnxing_21040_4,The legend's gotta be true! She really is Ashinohara's strongest!
Zuoyequnxing_21040_5,That sounds like the new manga...
Zuoyequnxing_21040_6,"Hmph! Then think about this, who published that manga? And why does the author only go by ""Snow"" and never show their real name?"
Zuoyequnxing_21040_7,There's only one explanation!
Zuoyequnxing_21040_8,The author is obviously someone from inside the Flaming Sakura! That manga's basically a history book!
Zuoyequnxing_21041_1,"Come on, move! We'll miss it if we don't hurry!"
Zuoyequnxing_21041_2,Ugh... do we really have to listen to him talk? Can't we just go buy the manga?
Zuoyequnxing_100_1,"According to the mission details, there's still one left."
Zuoyequnxing_101_1,Found the second one.
Zuoyequnxing_101_2,Copy. Efficient as always.
Zuoyequnxing_101_3,Everyone's on schedule. Don't rush. Stay alert.
Zuoyequnxing_101_4,Got it.
Zuoyequnxing_102_1,"This is the last one, right?"
Zuoyequnxing_102_2,Yeah.
Zuoyequnxing_103_1,All done. I'll send it to Lucilla and head back.
Zuoyequnxing_104_1,Third one secured.
Zuoyequnxing_104_2,Copy. Return to base. We're nearly done here.
Zuoyequnxing_104_3,Some sectors still aren't clear. How's everyone holding up?
Zuoyequnxing_104_4,All secure. We have teams handling cleanup. Just come back and regroup.
Zuoyequnxing_105_1,"We're blazing through these runes. Teamwork makes the dream work, huh?"
Zuoyequnxing_105_2,Right. I hope Sigrika is having the same luck.
Zuoyequnxing_105_3,"So while you were searching, I tried tuning into each rune's frequency. Each trace felt different."
Zuoyequnxing_105_4,"They're definitely real, but whatever's left behind is way too faint. Can't really feel what it is..."
Zuoyequnxing_106_1,What's going on?
Zuoyequnxing_106_2,"Ah, Mentor. You're back."
Zuoyequnxing_106_3,"We've finished analyzing the runes, but their meaning still escapes us."
Zuoyequnxing_106_4,"As for the overlapping coordinates, we've run multiple standard decryption algorithms, but the results are contradictory."
Zuoyequnxing_106_5,"I'm no rune expert… but we have a one here, don't we? She resonates with them."
Zuoyequnxing_106_6,Who—wait... Me?!
Zuoyequnxing_106_7,"You wanted to say something, didn't you?"
Zuoyequnxing_106_8,Bingo.
Zuoyequnxing_106_9,"…If you're asking me, these runes don't feel flat. They feel… spherical."
Zuoyequnxing_106_10,About this big. And these two points are relative… like this.
Zuoyequnxing_106_11,Three-dimensional coordinates... orthographic projection...
Zuoyequnxing_106_12,If we take the Reactor Drive's light data from the database as a depth layer and reconstruct it...
Zuoyequnxing_106_13,A map forms. The Royan runes are conveying a spherical map.
Zuoyequnxing_106_14,What are these two places...?
Zuoyequnxing_106_15,The one on the surface corresponds to the Stridergate. As for the one at the center... there's too little data to confirm.
Zuoyequnxing_106_16,"But by geometric definition, it's the origin point of the entire map."
Zuoyequnxing_106_17,The Exostrider. That must be where it is in Voidspace.
Zuoyequnxing_106_18,It's the only thing that could survive there. The lodestar Aemeath was trying to show me.
Zuoyequnxing_106_19,"Contamination around the Keystone is off the charts. We've got no viable spatial data. In other words, using the Stridergate to get you to Voidspace isn't an option."
Zuoyequnxing_106_20,I remember Lucilla mentioning a sealed rift in the Dimmr Plains.
Zuoyequnxing_106_21,"Yeah. right. Once Hiyuki from the Special Response Force breaks the seal, that could serve as a new entry point."
Zuoyequnxing_106_22,"But without the Exostrider... are you suggesting crossing the Stridergate and searching for it yourself, {PlayerName}?"
Zuoyequnxing_106_23,"Now that we have a concrete map, I should be able to retrieve the Exostrider before my power of Separation gives out."
Zuoyequnxing_106_24,...A compelling proposal. Hard to refuse.
Zuoyequnxing_106_25,But don't forget the Exostrider is currently out of power. Finding it is one thing. Extracting it is another.
Zuoyequnxing_106_26,Then we set a hard deadline.
Zuoyequnxing_106_27,If I can transmit the Exostrider's coordinates to you before Duskveil initiates—
Zuoyequnxing_106_28,Then tell me you'll consider entrusting the Drive Replica to us.
Zuoyequnxing_106_29,"""Consider,"" huh... so you're handing the choice to us?"
Zuoyequnxing_106_30,It's not about who's making the choice.
Zuoyequnxing_106_31,It's about trust.
Zuoyequnxing_106_32,I'm not asking for a guarantee.
Zuoyequnxing_106_33,"I'm trusting you, the professionals on this side, to make the right call. Whatever that call is."
Zuoyequnxing_106_34,...The Exostrider's value justifies the risk. I agree to your proposal.
Zuoyequnxing_106_35,"After successfully collecting all the Royan runes, Sigrika joins the decryption. She believes these runes were not drawn on a two-dimensional plane, but rather resemble spherical coordinates, possibly the coordinates of the Exostrider inside Voidspace. For this reason, you decide to venture back beyond the Gate. If you successfully recover the Exostrider, the Spacetrek Collective might entrust the Drive Replica to you and the Exostrider—you leave the call in their hands."
Zuoyequnxing_107_1,The Command Post only just pulled back from the Void Storm frontlines. Took longer than expected.
Zuoyequnxing_107_2,I've been briefed on the situation. Sorry I had to be absent for that.
Zuoyequnxing_107_3,No worries. It's all settled.
Zuoyequnxing_107_4,No worries. It's all settled.
Zuoyequnxing_107_5,"Still, I'd like a word with you before you go."
Zuoyequnxing_107_6,Let's meet by the Research Institute.
Zuoyequnxing_111_1,"Here. This is the Dimmr Plains map, updated with the latest intel."
Zuoyequnxing_111_2,Be mindful of the contamination. It's not just the Exoswarm or local lifeforms being affected. It's sealing off the terrain itself.
Zuoyequnxing_111_3,"That said, where there's a will, there's a workaround. Hiyuki found one, though it took her some time."
Zuoyequnxing_111_4,That miko?
Zuoyequnxing_111_5,Yes. She's been investigating the Dimmr Plains in secret. You'll meet her there.
Zuoyequnxing_111_6,"She also asked me to tell you that she's run into the Fractsidus there, including the missing girl, Denia."
