Id,Content
Zuoyequnxing_184_54,"Once the Drive Replica is embedded within the Exostrider, it completes its ascension and becomes a Sentinel. You and Aemeath pilot it together to defeat the mech forged by Aleph-1. But the victory is not permanent. The Exostrider warns that banishing Aleph-1 to the depths of the universe is only a temporary measure. It still retains the capacity to return one day. Because of this, the Exostrider chooses to bestow a portion of its power to Aemeath and elects to remain on the other side of the Stridergate, guarding the civilization that gave it a heart until the very end. Before you part, the Exostrider requests your permission to change its designation to bear a new name: ""Lahai-Roi."" It then leaves a gift for the people of Lahai-Roi inside your Cassette."
Zuoyequnxing_185_1,It's been so long since I last saw Solaris. Feels weirdly nostalgic.
Zuoyequnxing_185_2,"Now that Aleph-1's been kicked to the cosmic curb, Lahai-Roi can finally breathe easy."
Zuoyequnxing_185_3,I was gonna say we saved the world this time. But honestly...
Zuoyequnxing_185_4,It was the explorers who fell into the Voidmatter. They're the ones who mapped that data on me and the Exostrider inside the Threnodian's black hole. All I did was burn their findings onto a Cassette for you.
Zuoyequnxing_185_5,And it was the people of Lahai-Roi who decoded the Cassette and forged the Drive Replica. That's what let the Exostrider finally cast the Threnodian out.
Zuoyequnxing_185_6,So... this wasn't a story about heroes saving the world. It was the world saving its heroes. Right?
Zuoyequnxing_185_7,Yes. And now… we're home.
Zuoyequnxing_185_8,You're back?
Zuoyequnxing_185_9,"Yeah, I'm back now."
Zuoyequnxing_186_1,"During Aleph-1's recent activity, impact was successfully contained to the Dimmr Plains."
Zuoyequnxing_186_2,"Within the Plains themselves, Voidmatter concentrations have dropped significantly across most sectors."
Zuoyequnxing_186_3,Monitoring data from the Spacetrek Collective confirms that Threnodian markers within the region of Lahai-Roi have now fallen to near-zero levels.
Zuoyequnxing_186_4,"Exostrider activity has fully ceased. However, related research into its technology will continue."
Zuoyequnxing_186_5,Mech units deployed by Startorch Academy have successfully neutralized all anomalous constructs activated by the Threnodian across Lahai-Roi.
Zuoyequnxing_186_6,The experience gained through this mission will carry forward.
Zuoyequnxing_186_7,"In Bjartr Woods, the area closest to the Threnodian's attempted breach, partial structural damage has been confirmed. Overall, the situation remains well within control."
Zuoyequnxing_186_8,"As Voidmatter levels continue to drop, the Roya will regain access to a broader and more stable range of territory."
Zuoyequnxing_186_9,"Once shrouded in Voidmatter, Lahai-Roi now stands restored. This was made possible by the choice of every last explorer."
Zuoyequnxing_186_10,"The road ahead is vast. We will reach the stars. And then, we'll keep going."
Zuoyequnxing_187_1,You made it!
Zuoyequnxing_187_2,"Turns out, decoding what the Exostrider burned into your Cassette was way tougher than the Institute thought. They only just finished today!"
Zuoyequnxing_187_3,"Over here, {PlayerName}! Everyone's waiting for you!"
Zuoyequnxing_187_4,"What could it possibly be... Oh, I can't wait to find out."
Zuoyequnxing_187_5,The Farwatcher.
Zuoyequnxing_187_6,"I have to admit, {PlayerName}, I was genuinely surprised when you handed me this tape and said that name."
Zuoyequnxing_187_7,You said it was one of the nine interstellar space probes launched before the Etheric Sea engulfed Solaris.
Zuoyequnxing_187_8,Correct. The nine stars on the Spacetrek Collective's emblem represent those probes.
Zuoyequnxing_187_9,"Ever since then, Solaris never received another signal from them. Not a single one."
Zuoyequnxing_187_10,...Until today.
Zuoyequnxing_187_11,"Professor Mornye, you may begin playback."
Zuoyequnxing_187_12,This... Sounds like white noise...
Zuoyequnxing_187_13,"Judging by the Cassette's data, they're sounds the Farwatcher recorded while drifting through different galaxies."
Zuoyequnxing_187_14,"Sounds that have been lost to us for centuries, silenced by the Etheric Sea."
Zuoyequnxing_187_15,So that's why... the Exostrider wanted to give these recordings to the explorers of Lahai-Roi today.
Zuoyequnxing_187_16,Because this is a gift from light-years away. Sent by the explorers of Lahai-Roi's past...
Zuoyequnxing_187_17,...Echoes from the sea of stars.
Zuoyequnxing_187_18,"Some days after the crisis is resolved, you arrive at the Research Institute to join the others in analyzing the gift the Exostrider left inside your Cassette. 
It is white cosmic noise recorded by ""the Farwatcher,"" one of nine interstellar space probes launched before the Etheric Sea engulfed Solaris. It is the voice of the stars, captured by explorers who came before, a message that, after an eternity, finally found its way home."
Zuoyequnxing_188_1,"The Spacetrek Collective has taken in that Denia girl. Just as you wished, Grand Architect."
Zuoyequnxing_188_2,Good. Just let them care for the little doll for now. Such an extraordinary performance. I'm sure I can find another role for her later.
Zuoyequnxing_188_3,All retrieved data has been processed. Awaiting review at your leisure.
Zuoyequnxing_188_4,May I ask what you plan to do next?
Zuoyequnxing_188_5,Plans are progressing everywhere it seems. I've dallied in Lahai-Roi long enough. Time to stretch my legs.
Zuoyequnxing_188_6,"Cristoforo, be a dear and run a message to Eris in the New Federation for me."
Zuoyequnxing_188_7,"Understood. Though I suspect the Vice Architect will begrudge, once more, your sending me to disturb their precious quiet."
Zuoyequnxing_188_8,Oh... and will you require me to draft a prologue for your characters?
Zuoyequnxing_188_9,No need. I'll pay Phrolova a visit myself first. That will be all for now. This body tires so easily. Remember to give her a silent ending...
Zuoyequnxing_188_10,"Grand Architect, with this phase of verification complete and full production proceeding… do we still have use for that miko?"
Zuoyequnxing_188_11,That won't be necessary. Her future as a Threnodian Resonator has been taken. She no longer requires our attention.
Zuoyequnxing_188_12,"Besides, she's failed one too many times. Drawn one too many futures from herself. And she still insists on walking the path of saving Ashinohara alone, with no intention of stopping."
Zuoyequnxing_188_13,Every step she takes only deepens that obsession.
Zuoyequnxing_188_14,"After countless cycles of failure, she too will be reduced to ashes by her own vow. Just like her sister."
Zuoyequnxing_188_15,Ah... that reminds me. Zashiki‑warashi has brought us some rather interesting news.
Zuoyequnxing_188_16,"In an empty classroom, the Grand Architect contacts the Overseers from various regions. She spares no thought for the Ashinohara miko she once sought to recruit. Hiyuki has already burned through every possible future as a Threnodian Resonator. One day, she too will be reduced to ash by her own wish, just like her sister Gyokuro before her."
Zuoyequnxing_189_1,(Gyokuro must be just ahead...)
Zuoyequnxing_189_2,(This was Honami's last Rite of Purging.)
Zuoyequnxing_190_1,(All is settled. Only one final thing remains.)
Zuoyequnxing_191_1,"(I have truly... kept you waiting for too long, Gyokuro.)"
Zuoyequnxing_192_10,"Come then, Miko of Eternal Flaming Sakura."
Zuoyequnxing_192_11,...
Zuoyequnxing_192_12,Calm yourself.
Zuoyequnxing_192_13,A restless heart makes for unsteady hands.
Zuoyequnxing_192_14,But... I do not wish to learn this.
Zuoyequnxing_192_15,Then what do you wish to learn?
Zuoyequnxing_192_16,This girl will become a great archer.
Zuoyequnxing_192_17,"No, look at her hands... they're a swordsman's hands."
Zuoyequnxing_192_18,Not in this life.
Zuoyequnxing_192_19,Her hands aren't ones to hold a blade. Isn't that right?
Zuoyequnxing_192_20,Well now. You have refined your technique.
Zuoyequnxing_192_21,Hmph.
Zuoyequnxing_192_22,Hiyuki...
Zuoyequnxing_192_23,Do not let the Suzu bind your fate.
Zuoyequnxing_192_24,Go seek a future of your own.
Zuoyequnxing_192_25,"Focus, Hiyuki."
Zuoyequnxing_192_26,Survive this strike—
Zuoyequnxing_192_27,And reach your tomorrow.
Zuoyequnxing_193_1,"Tsk, tsk. You have mastered many skills from others, but have yet to master the bladework of your own Flaming Sakura clan."
Zuoyequnxing_193_2,The last Miko withheld too much. She refused to teach me a single technique.
Zuoyequnxing_193_3,Do you resent her?
Zuoyequnxing_193_4,I do.
Zuoyequnxing_193_5,Even now?
Zuoyequnxing_193_6,Every moment.
Zuoyequnxing_193_7,"I resent that she did not step down long ago. Instead, she burned every future she had and left nothing behind. Not even ashes."
Zuoyequnxing_193_8,I resent that she did not pass her skills to me. That she sent me away each time she trained. Now... there is nothing of her left in me.
Zuoyequnxing_193_9,Hiyuki...
Zuoyequnxing_193_10,"I resent that she always told me to ""be myself,"" yet chose a death that was nothing like herself."
Zuoyequnxing_193_11,"And you resent that even after dying, she lingered as a spirit, waiting only for you to send her on."
Zuoyequnxing_193_12,"Ah. I was being cruel, wasn't I?"
Zuoyequnxing_193_13,"It's just... I couldn't let my fear go. No one understood the scale of your gift, Hiyuki. Your potential to tame even a Threnodian."
Zuoyequnxing_193_14,"If you drew such a future, would everything not become much easier?"
Zuoyequnxing_193_15,"Gyokuro, I..."
Zuoyequnxing_193_16,"As long as it comes from your own heart and will, any future you choose is acceptable."
Zuoyequnxing_193_17,"But if our little Hiyuki truly became a Threnodian Resonator... Well. I'd have no choice but to follow ""family law"" and send us both on our way."
Zuoyequnxing_193_18,I have already burned that future.
Zuoyequnxing_193_19,I accepted the Suzu of my own will. I chose to become the Miko of Flaming Sakura.
Zuoyequnxing_193_20,I know why you refused to teach me your swordsmanship. You never wanted there to be another Miko after you.
Zuoyequnxing_193_21,"I will fulfill that wish, Sister."
Zuoyequnxing_193_22,"After Hiyuki, there will be no more Mikos of Flaming Sakura."
Zuoyequnxing_193_23,The Miko of Eternal Flaming Sakura... That is a heavy title to bear.
Zuoyequnxing_193_24,It is.
Zuoyequnxing_193_25,"The future ahead is long. Very, very long."
Zuoyequnxing_193_26,I know.
Zuoyequnxing_193_27,"Through the Suzu, we draw strength from countless possible futures."
Zuoyequnxing_193_28,"But each time you do, you see yourself draw closer to Miko's destined end. A future burned to cinders, leaving nothing behind."
Zuoyequnxing_193_29,"Yes. And before that destined end arrives, I will find a way to drive back the Threnodian."
Zuoyequnxing_193_30,So that Gyokuro may simply be Gyokuro. So that Hiyuki may simply be Hiyuki. So that Ashinohara will no longer need a Miko of Flaming Sakura.
Zuoyequnxing_193_31,"You have grown up, our little Hiyuki."
Zuoyequnxing_193_32,...
Zuoyequnxing_193_33,"I met someone, Sister. Unlike me, who failed Ashinohara, {Male=he;Female=she} always finds a way to save."
Zuoyequnxing_193_34,"That must be difficult for you to bear, little Hiyuki."
Zuoyequnxing_193_35,Yes. At first... it was.
Zuoyequnxing_193_36,"Hearing tales of {Male=his;Female=her} exploits, I felt a deep admiration. No, perhaps it was closer to jealousy."
Zuoyequnxing_193_37,"I thought, if only I possessed {Male=his;Female=her} strength. Then my days would not be filled with regret. Ashinohara would be saved."
Zuoyequnxing_193_38,"And I... in the peace that followed, could have lived an ordinary life."
Zuoyequnxing_193_39,"But upon meeting {Male=him;Female=her}, I came to understand. Even a great ""savior"" carries many pains and failures."
Zuoyequnxing_193_40,"And the path of a savior is walked not alone, but alongside countless others."
Zuoyequnxing_193_41,Gyokuro.
Zuoyequnxing_193_42,Yes?
Zuoyequnxing_193_43,I have always admired you as the Miko of Flaming Sakura. And I have always... held you in the highest honor.
Zuoyequnxing_193_44,Even if one day I am burned to ashes...
Zuoyequnxing_193_45,Because of you.... because of {Male=him;Female=her}... because they all exist... I am never truly alone.
Zuoyequnxing_193_46,"I take great pride in you, too."
Zuoyequnxing_193_47,"Go on, Shiratori. Fly to where your heart desires."
Zuoyequnxing_193_48,"May the day come when you, too... step into spring as freely as anyone in this world."
Zuoyequnxing_193_49,"Hiyuki tells Gyokuro how much she still misses her—the longing, the resentment, and finally her wish: to become the Miko of Flaming Sakura who defeats the Threnodian, so that Ashinohara will never need another miko after her.
But Hiyuki admits that meeting Rover changed something in her. She no longer despairs over countless failures. Though she knows a future awaits where she burns to ash, knowing she once had a companion on this path makes the pain easier to bear. 
Before Gyokuro fades away, she tells Hiyuki that she has always been proud of her."
Zuoyequnxing_194_1,"Greetings, Miko of Flaming Sakura."
Zuoyequnxing_194_2,...You.
Zuoyequnxing_194_3,"Oh, relax. I'm not here to recruit you. I just heard a piece of news and thought you might want to know."
Zuoyequnxing_194_4,"Not long ago, that island floating over the sea, your hometown—"
Zuoyequnxing_194_5,It vanished. All in a single day.
Zuoyequnxing_194_6,"Congratulations on your wish coming true, Lady Miko."
Zuoyequnxing_194_7,"A message arrives for Hiyuki from the Grand Architect: ""Ashinohara has vanished in a single day. Congratulations on your wish coming true, Miko of Flaming Sakura."""
Zuoyequnxing_201_1,The end... Silent...
Zuoyequnxing_202_1,Prove... Existence... You...
Zuoyequnxing_203_1,Hope... Stagnate...
Zuoyequnxing_204_1,Silence... Eternal...
Zuoyequnxing_207_1,Almost finished up here at the Academy. Heading back now!
Zuoyequnxing_207_2,"I know you're busy, so no need to reply. Cya over at Professor Mornye's!"
Zuoyequnxing_208_1,Friend sent a nudge
Zuoyequnxing_208_2,I was sent to search the area near the Academy.
Zuoyequnxing_208_3,...Be careful.
Zuoyequnxing_208_4,Contact me if you need any help.
Zuoyequnxing_208_5,Don't worry.
Zuoyequnxing_208_6,Copy. I'll leave that side to you.
Zuoyequnxing_208_7,Don't worry. I'll see you later.
Zuoyequnxing_208_8,See you once the mission is over.
Zuoyequnxing_208_9,Alright. See you then.
Zuoyequnxing_21011_1,Mmm... the spring breeze is so warm.
Zuoyequnxing_21011_2,"So, how've you been feeling the last few days?"
Zuoyequnxing_21011_3,"Much better, actually. I feel fine."
Zuoyequnxing_21011_4,"Still a little dizzy, honestly..."
Zuoyequnxing_21011_5,Hmph. You soaked in Voidmatter for that long... and you're telling me you're fine? Better not be lying to me.
Zuoyequnxing_21011_6,"...Being alone in Voidmatter that long will have taken a toll on your body, even with the white bird's protection."
Zuoyequnxing_21011_7,"Just thinking about what you risked... Hey, don't you ever do something like that again, okay?"
Zuoyequnxing_21011_8,"I could say the same to you, Aemeath. You think what you did before was any less risky? ""Never coming back"" isn't exactly my idea of a happy ending."
Zuoyequnxing_21011_9,That—ahem...
Zuoyequnxing_21011_10,"...Okay. I'm sorry, alright? Back then... I didn't have a choice."
Zuoyequnxing_21011_11,You know how it is. Sometimes there are things you just have to do.
Zuoyequnxing_21011_12,...I know.
Zuoyequnxing_21011_13,But I still worry about you.
Zuoyequnxing_21011_14,...I won't do it again. Promise. Cross my heart.
Zuoyequnxing_21011_15,"Besides, look at us now! We're both okay. And Lahai-Roi's safe! That's a pretty happy ending, right?"
Zuoyequnxing_21011_16,"The savior and the world, saving each other at last! A tale for the ages!"
Zuoyequnxing_21011_17,"Aemeath, there's something I want to ask you."
Zuoyequnxing_21011_18,Hmm? What is it?
Zuoyequnxing_21011_19,After you were sealed beyond the Stridergate... how long were you out there? Alone?
Zuoyequnxing_21011_20,You've been dodging this. But I don't want you to keep choosing to handle this alone.
Zuoyequnxing_21011_21,...
Zuoyequnxing_21011_22,"Aww... feels like if I try to brush this off again, I'm gonna get scolded for real."
Zuoyequnxing_21011_23,"...Honestly, I can't really remember anymore. Toward the end, I couldn't even tell if time was still moving."
Zuoyequnxing_21011_24,It was just darkness. Emptiness. Over and over. Boring. Monotonous.
Zuoyequnxing_21011_25,"But hey, I've had practice being alone. It's fine."
Zuoyequnxing_21011_26,"The ones who faded into nothing... they were with me, you know. In all that dark, the light of every explorer who came before never stopped shining."
Zuoyequnxing_21011_27,Knowing I was protecting the place they came from made it hurt a little less.
Zuoyequnxing_21011_28,"When I had the ""Origin Point"" and saw you, the gravity pulled me back and I... I couldn't go with you. That stung. But the moment I saw you? That made me so happy."
Zuoyequnxing_21011_29,Seeing you again... that was enough.
Zuoyequnxing_21011_30,"Me too, Aemeath."
Zuoyequnxing_21011_31,"Okay, okay, this is getting way too heavy! Let's talk about something fun! You know, this whole thing is kind of a blessing in disguise."
Zuoyequnxing_21011_32,"People could only see me before. But now... I can ""pilot"" this shell to actually interact with people."
Zuoyequnxing_21011_33,Pilot...?
Zuoyequnxing_21011_34,"Mm, kinda like being in my mech form? I mean, I did die. Having a shell doesn't mean I'm alive again."
Zuoyequnxing_21011_35,"But it's similar to the Exoswarm, and since I'm the Exostrider's Resonator... I'd say ""piloting"" this body feels about right."
Zuoyequnxing_21011_36,"And because of that, I've decided to stick around for a while and finish my studies!"
Zuoyequnxing_21011_37,For a while?
Zuoyequnxing_21011_38,"Yep! The Threnodian thing in Lahai-Roi is already handled, and I wanna be a real savior who helps more people. So after this... I'm gonna travel around Solaris."
Zuoyequnxing_21011_39,"But first, I'll stay at Startorch to graduate. I mean, I never even got my degree before I turned into a digital ghost!"
Zuoyequnxing_21011_40,"Gotta give my school days a proper send-off, y'know?"
Zuoyequnxing_21011_41,Aemeath.
Zuoyequnxing_21011_42,Yeah?
Zuoyequnxing_21011_43,"Even if it isn't a happy, carefree life... If it's the one you choose, I'll be proud of you."
Zuoyequnxing_21011_44,"So go follow your heart, Aemeath. I'll always be right here."
Zuoyequnxing_21011_45,...Okay. I won't forget.
Zuoyequnxing_21011_46,But before all that—walk with me? Just us and the spring breeze!
Zuoyequnxing_21011_47,"You find Aemeath and finally talk to her about what happened. She tries to deflect at first, but eventually yields under your steady gaze. The two of you speak of the helplessness of goodbye, and the terrible loneliness she endured during her long wait beyond the Stridergate—until the moment you found each other again in the darkness. What happened, she admits, turned out to be a blessing in disguise. She can now complete her studies at the Academy in a physical form. 
You tell her that even if life isn't always happy or carefree, as long as it's the one she chooses, you will always be proud of her. 
Aemeath gives you a relieved smile. 
She reaches out her hand, inviting you to walk with her. Spring, at last, no longer exists only in dreams."
Zuoyequnxing_21012_1,Friend sent a nudge
Zuoyequnxing_21012_2,The Collective wants to discuss the handling of the Aleph-1 aftermath with you.
Zuoyequnxing_21012_3,"If you're free, meet me at the Academic Affairs Office."
Zuoyequnxing_21012_4,Understood.
Zuoyequnxing_21012_5,Got it.
Zuoyequnxing_21012_6,Understood. I'm on my way.
Zuoyequnxing_21012_7,Got it. I'll head over now.
Zuoyequnxing_21012_8,"Wait... Something just came up. You know, the usual pointless reporting and corporate rhetoric."
Zuoyequnxing_21012_9,Hiyuki will meet you there instead.
Zuoyequnxing_21013_1,..Hiyuki?
Zuoyequnxing_21013_2,Lucilla just left. There are still matters at the Academy regarding your identity that needed handling.
Zuoyequnxing_21013_3,"She had wanted to discuss the Collective's next steps with you. They've buried the Exostrider's disappearance with an official story, but as for who activated it... they want to keep it a secret."
Zuoyequnxing_21013_4,That's the right call.
Zuoyequnxing_21013_5,A cautious approach is smart.
Zuoyequnxing_21013_6,"I'll be leaving Lahai-Roi before long. The fewer eyes on me, the better."
Zuoyequnxing_21013_7,"Yes. She said that is the best way to protect you. Students will talk, that cannot be helped. But officially, the line is that the Exostrider ""awoke on its own."""
Zuoyequnxing_21013_8,"A wise choice. Fame is no blessing. If the Collective draws scrutiny from other regions, your freedom may not remain your own."
Zuoyequnxing_21013_9,"That was all she wished to convey, but I waited here to tell you something else."
Zuoyequnxing_21013_10,"Hiyuki recounts her encounters with the Fractsidus, and the situation in Ashinohara…"
Zuoyequnxing_21013_11,"She speaks as evenly as always, but between her words lingers a sigh as quiet as falling snow."
Zuoyequnxing_21013_12,Ashinohara…
Zuoyequnxing_21013_13,…How are you holding up?
Zuoyequnxing_21013_14,"Do not worry over me. As for Ashinohara... Lucilla will assist with the investigation. Once matters here are settled, I will return."
Zuoyequnxing_21013_15,But you must be careful. The Fractsidus seem to track your every move.
Zuoyequnxing_21013_16,"Their plans for Denia and me may have failed, but it proves one thing. They have found a way to harness Threnodian power."
Zuoyequnxing_21013_17,"Spying from the shadows... that does sound like them. Thank you, I'll be careful."
Zuoyequnxing_21013_18,"By the way, how is Denia?"
Zuoyequnxing_21013_19,"She is still undergoing treatment and remains unstable. The Collective seem to have special arrangements for her. I wished to visit, but Lucilla said I am the one person who cannot..."
Zuoyequnxing_21013_20,"Well, it was your blade that struck her down."
Zuoyequnxing_21013_21,"In that strike, I used the frequency you left within her. The one that ""separates."" That was what freed her from the Threnodian's control."
Zuoyequnxing_21013_22,"So in her eyes, you are likely just as frightening as I am."
Zuoyequnxing_21013_23,"Still, I hear her disposition may have changed. I should like to visit her one of these days... Hm."
Zuoyequnxing_21013_24,"Lucilla has more reports for me, something about Ashinohara. I should go."
Zuoyequnxing_21013_25,"Okay. If I can help with Ashinohara, just let me know."
Zuoyequnxing_21013_26,"Rest easy. As the ""savior"" {Male=himself;Female=herself}  taught me, this long road to save Ashinohara was never meant to be walked alone."
Zuoyequnxing_21013_27,Go on.
Zuoyequnxing_21013_28,...Perhaps I too can walk toward the spring you spoke of.
Zuoyequnxing_21013_29,"Hiyuki speaks to you about matters concerning Ashinohara, the Fractsidus, and her future path that she never had the chance to share before. She feels changed by everything that has happened.
Before you part, her white bird flies into your chest and disappears. Hiyuki gazes out the window, looking forward to that distant future of stepping into spring for the first time."
Zuoyequnxing_21060_1,Found the first one.
Zuoyequnxing_21060_2,Copy. You're in the most dangerous sector now. Be careful out there.
Zuoyequnxing_21060_3,I know.
Zuoyequnxing_21070_1,The light of the Origin Point... <ano=The Exostrider and I>We</ano> will bear it.
Zuoyequnxing_21080_1,Finally came to see me?
Zuoyequnxing_21080_2,Yes. I have come.
Zuoyequnxing_21080_3,Made up your mind?
Zuoyequnxing_21080_4,I have.
Zuoyequnxing_21080_5,"Ready to kill me, then?"
Zuoyequnxing_21080_6,...Yes.
Zuoyequnxing_21080_7,Oh? Has my little Hiyuki grown so confident that she can best me without even drawing her blade?
Zuoyequnxing_21080_8,"Now, now... Don't forget who taught the Miko of Eternal Flaming Sakura. Can't show a little respect to your elder?"
Zuoyequnxing_21080_9,"You call what you did to me teaching, Gyokuro?"
Zuoyequnxing_224_1,Please note that the following requires no reply.
Zuoyequnxing_224_2,Mission parameters have been set. All units are to proceed to your assigned sectors now. Secure the Royan runes at your coordinates and report back via Wavesline.
Zuoyequnxing_224_3,"As I mentioned before, we've divided everyone based on your expertise and field experience."
Zuoyequnxing_224_4,"The Lahai-Roi subterranean zone is divided into the Academy, the Research Institute, and Bjartr Woods. Each unit will go to the sector matching their expertise."
Zuoyequnxing_224_5,"I have full confidence in your abilities, and I ask that you place your trust in our strategic deployment. Return to the Research Institute the moment your missions are done."
Zuoyequnxing_224_6,"To our Roya partners and Spacetrek Collective personnel: by choosing to leave the shelters and stand with us now, you have proven your readiness to sacrifice for the cause."
Zuoyequnxing_224_7,"However, this rune recovery plan is not a march toward martyrdom."
Zuoyequnxing_224_8,"Complete your missions within the time limit. Should any unforeseen situations arise, abort the mission immediately and return to the Research Institute."
Zuoyequnxing_224_9,Please remember that your teammates are right behind you.
Zuoyequnxing_224_10,"And finally, just as you've all hoped, we are now forging a path toward the future of Solaris."
Zuoyequnxing_224_11,"For that future, no price is too high."
Zuoyequnxing_224_12,"Even if the Void takes everything, the will of humanity will never be snuffed out."
