Id,Content
Zuoyequnxing_224_13,My highest regards to you all.
Zuoyequnxing_225_1,Updating current progress now. Royan rune collection is on schedule. We've received reports of injuries with medical teams already en route to those coordinates.
Zuoyequnxing_225_2,A one-way public channel is now open. We'll use it to keep you all posted on any developments.
Zuoyequnxing_226_1,Research Institute Sector collection is nearly complete. Academy Sector and Bjartr Woods Sector are at fifty percent.
Zuoyequnxing_226_2,"All units that have completed your missions, report back to the Research Institute immediately."
Zuoyequnxing_226_3,Team 7 returned.
Zuoyequnxing_226_4,Team 10 is preparing to return.
Zuoyequnxing_226_5,Team 14 returned.
Zuoyequnxing_226_6,Team 22 returned.
Zuoyequnxing_226_7,Team 20 returning with Team 17 and 19. Team member Nastasha is injured.
Zuoyequnxing_226_8,Team 4 returned!
Zuoyequnxing_226_9,Team 2 confirms return.
Zuoyequnxing_226_10,Team 9 returning now!
Zuoyequnxing_226_11,Copy that. Please stay safe.
Zuoyequnxing_227_1,"Collection complete for Research Institute, Academy, and Bjartr Woods Sectors."
Zuoyequnxing_227_2,"All units that have completed your missions, report back to the Research Institute immediately."
Zuoyequnxing_227_3,Team 6 confirms return.
Zuoyequnxing_227_4,Team 3 confirms return.
Zuoyequnxing_227_5,Team 8 confirms return.
Zuoyequnxing_227_6,Team 18 and 13 confirm return.
Zuoyequnxing_227_7,Team 5 confirms return.
Zuoyequnxing_227_8,Communication with several teams is currently blocked. Specialized Security Teams have been deployed for search and rescue.
Zuoyequnxing_227_9,All units except for Team 11 have been intercepted by Security and are returning to base. Vital signs for all Team 11 members remain stable.
Zuoyequnxing_227_10,"Well done, everyone."
Zuoyequnxing_227_11,"Please report to Dr. Luuk and N.A.N.A. for medical evaluation, then return to the shelter at once."
Zuoyequnxing_227_12,"Analysis of the Royan runes has already begun. You have all done your best. Now, it's our turn to uncover the secrets hidden within them."
Zuoyequnxing_228_1,Are you back?
Zuoyequnxing_228_2,Yeah...
Zuoyequnxing_228_3,I'm back.
Zuoyequnxing_228_4,Still trying to wrap my head around everything.
Zuoyequnxing_228_5,"Yes, I'm back. About the Exostrider..."
Zuoyequnxing_228_6,It's alright. We already know. Your safe return is what matters now.
Zuoyequnxing_228_7,"Anyway, come meet us at the Research Institute. Everyone's been waiting for you."
Zuoyequnxing_228_8,Got it.
Zuoyequnxing_229_1,"It's past the estimated waiting time... But I know you'll be alright, Mentor."
Zuoyequnxing_229_2,Voidmatter concentrations are already above the threshold. We have to retreat to the Institute's shelter now. Please head there as soon as you are back.
Zuoyequnxing_229_3,"Mentor, I was just approved to stay and ensure that the Collective's emergency protocols proceed as planned. I'll be waiting for you at the Institute."
Zuoyequnxing_229_4,"Mentor, you're back!"
Zuoyequnxing_229_5,"Yes, I'm back."
Zuoyequnxing_229_6,"We were just in contact, but yes... I am back."
Zuoyequnxing_229_7,Must've been signal interference in Void Space. I only just received your messages.
Zuoyequnxing_229_8,I see... I'm just glad you're back. We can talk about everything else once you get to the Institute. Are you feeling alright?
Zuoyequnxing_229_9,I'm fine.
Zuoyequnxing_229_10,"Don't worry, I feel perfectly fine."
Zuoyequnxing_229_11,"That's a relief... In that case, come over to the Institute first."
Zuoyequnxing_230_1,Still not back yet?
Zuoyequnxing_230_2,Voidmatter concentrations just spiked. Profs are locking everyone down at the Institute.
Zuoyequnxing_230_3,"I know you'll be fine. We've got rides waiting. You wouldn't bail on that, would you?"
Zuoyequnxing_231_1,Voidmatter concentrations have passed the safety limit. The Spacetrek Collective is already starting the evacuation of Lahai-Roi.
Zuoyequnxing_231_2,I am staying behind for you. To the very end.
Zuoyequnxing_231_3,I'm back.
Zuoyequnxing_231_4,Are you still in the underground sector?
Zuoyequnxing_231_5,Glad to know you are alright.
Zuoyequnxing_231_6,How's the situation on your end?
Zuoyequnxing_231_7,How's the situation on your end? Need any help?
Zuoyequnxing_231_8,"It is proving difficult. As the Voidmatter intensifies, locating people has grown increasingly challenging..."
Zuoyequnxing_231_9,Do not worry about me. Go. Join Lucilla and the others.
Zuoyequnxing_232_1,{PlayerName}... Where are you now?
Zuoyequnxing_232_2,Friend sent a nudge
Zuoyequnxing_232_3,"{PlayerName}, I've been asking everyone. Even Lynae was being vague about it, but I figured it out…"
Zuoyequnxing_232_4,"You're in Voidspace, aren't you? Just like when we first arrived at the Academy."
Zuoyequnxing_232_5,"You made it out safely last time. I know you'll make it out this time, too."
Zuoyequnxing_232_6,There's a Void Storm in the Academy right now...
Zuoyequnxing_232_7,"{PlayerName}, I'm at the Research Institute. Professor Mornye is here, too."
Zuoyequnxing_232_8,I am confident that you'll be alright... You always find a way to handle whatever comes your way.
Zuoyequnxing_233_1,"Senior, Voidmatter concentrations are critical! We're all moving to the Spacetrek Collective's shelter now."
Zuoyequnxing_233_2,"There's someone helping my tribe evacuate, and right now I'm filtering and archiving all historical records from the Solisylum for separate storage."
Zuoyequnxing_233_3,"You must be very busy now, right? I'll see you when you get back!"
Zuoyequnxing_234_1,You needn't worry about us. We're handling everything on this end.
Zuoyequnxing_234_2,"I know you'll come through, just like you always do. I'll be waiting for the good news."
Zuoyequnxing_235_1,Lament. Lament. Lament.
Zuoyequnxing_49_1,"Hello, {Male=golden boy;Female=golden girl}."
Zuoyequnxing_49_2,"Now that the Dark Side incident is wrapped up, manage any rest after the ceremony?"
Zuoyequnxing_49_3,"Things will get busy again soon. You'll need to stay focused, but not wound up like a spring. Stress leads to bad calls."
Zuoyequnxing_49_4,I've rested up. Don't worry.
Zuoyequnxing_49_5,I can't really relax until this is over.
Zuoyequnxing_49_6,I've rested up. Don't worry.
Zuoyequnxing_49_7,"Good. I'm a psychiatrist, after all. Happy to know my patient is actually following my advice for once."
Zuoyequnxing_49_8,I can't really relax until this is over.
Zuoyequnxing_49_9,"I see. I sympathize, but can't say I approve. Once this is all settled, remember to give yourself a break."
Zuoyequnxing_49_10,"As for the Exostrider plan we discussed earlier, there's been a development."
Zuoyequnxing_49_11,"Come to my ""workspace."" It's better discussed where the walls don't have ears."
Zuoyequnxing_50_1,Candy? It's a new flavor. Sigrika and Lynae suggested it. Great for lifting spirits.
Zuoyequnxing_50_2,...Mint jelly.
Zuoyequnxing_50_3,"Yep, that'll wake you up."
Zuoyequnxing_50_4,"Alright, Luuk. What's the word on this Exostrider plan?"
Zuoyequnxing_50_5,My conversation with Lucilla went well. She's on your side. Your showing during the Dark Side incident also helped speed up the Academy's internal review.
Zuoyequnxing_50_6,"That said, you've been a student here for less than a year. You'll need the Spacetrek Collective's approval to officially activate the Exostrider."
Zuoyequnxing_50_7,"Their biggest financial backer is the New Federation. And of course, they answer to an entire board of investors."
Zuoyequnxing_50_8,"And to them? The Exostrider is definitely a ""high-value asset."""
Zuoyequnxing_50_9,"I've been flooding their desks with reports. Your Academy investigation record, your latest test scores from Rabelle College, and a full physical adaptability eval I wrote myself..."
Zuoyequnxing_50_10,And? Were they rejected?
Zuoyequnxing_50_11,"We got a meeting. But when that much money's involved, conflicts of interest make everything move very slowly."
Zuoyequnxing_50_12,"Unlike Jinzhou or Rinascita, they've got far too many ""cooks"" in the kitchen."
Zuoyequnxing_50_13,I'm worried we don't have that kind of time.
Zuoyequnxing_50_14,"Exactly. Which is why we're going to strike first. Besides, things have changed."
Zuoyequnxing_50_15,It all comes down to this guy.
Zuoyequnxing_50_16,This is Chase. Head of the Spacetrek Collective. He just got back to Lahai-Roi on a Triumph Avionics ship from the New Federation.
Zuoyequnxing_50_17,"President Lucilla, Professor Mornye, and I have all put in a good word. You'll be meeting him at the Research Institute."
Zuoyequnxing_50_18,Chase started as a low-level employee at Ashridge Energy in the New Fed. Then he dropped off the grid for a few years before resurfacing in a government position.
Zuoyequnxing_50_19,"After that, he left the government and started diving into multiple large-scale investment projects. Some say he's still been Ashridge Energy's man the whole time, but no one's been able to prove it."
Zuoyequnxing_50_20,"He's sharp, low-profile, and very smooth. At his age, he's seen it all. His only real concern is if the Exostrider's pilot can be controlled."
Zuoyequnxing_50_21,"Normally, they'd pick Academy Synchronists who've been signing stacks of NDAs since day one. But—"
Zuoyequnxing_50_22,"Sounds like his attitude changed? Does that have something to do with the ""changes"" you mentioned?"
Zuoyequnxing_50_23,Come in. Let's talk over some hot drinks.
Zuoyequnxing_50_24,"You enter Luuk Herssen's workspace to discuss piloting the Exostrider. Luuk tells you that the Academy's procedures have already been handled by him and Lucilla, but you still need to win over the board of investors from the New Federation.
The Head of the Spacetrek Collective, Chase, has recently returned to Lahai-Roi from the New Federation."
Zuoyequnxing_51_1,I heard Lucilla asked for your help after the ceremony. How did it feel working with her?
Zuoyequnxing_51_2,"Well, at first she was pretty dominant, steering the conversation the whole time…"
Zuoyequnxing_51_3,But now I understand it's because this Academy means so much to her.
Zuoyequnxing_52_1,"Based on your intel, the Reactor Core has been returned. Ideally, we'd wait for the Exostrider to awaken before trying to help Aemeath or confront the Threnodian."
Zuoyequnxing_52_2,"But, recent readings from the Institute's Stridergate monitors... they're off the charts."
Zuoyequnxing_52_3,"Voidmatter reactivity is spiking. The Spacetrek Collective is getting twitchy. If Threnodian Aleph-1 breaks the seal, all of Solaris will be at risk, not just Lahai-Roi."
Zuoyequnxing_52_4,"Now, the Collective didn't establish itself here without binders full of contingencies for a Threnodian event."
Zuoyequnxing_52_5,"Problem is, every one of those plans would scorch decades of scientific progress."
Zuoyequnxing_52_6,"Which, in our case, actually gives us some leverage. Enough to have a real conversation with their head."
Zuoyequnxing_52_7,... Then I'll convince him. I'll show him the lowest casualty count is the only one that makes sense. He'll have to approve me as the Synchronist who pilots the Exostrider.
Zuoyequnxing_52_8,"Luuk, you mentioned you have contacts in the Black Shores. And this workspace of yours... It's secure, right?"
Zuoyequnxing_52_9,Guaranteed. What are you thinking?
Zuoyequnxing_52_10,Lahai-Roi is closed off from the outside world. Public comms are probably tapped by Fractsidus moles inside the Academy. And right now... I need a direct line to the Black Shores.
Zuoyequnxing_52_11,I see. Give me a moment. I'll establish the link and leave the rest to you.
Zuoyequnxing_52_12,"I received your call, {PlayerName}."
Zuoyequnxing_52_13,...Is the situation in Lahai-Roi that dire? You look exhausted.
Zuoyequnxing_52_14,"...A lot has happened, Shorekeeper."
Zuoyequnxing_52_15,I'm alright. Just a little tired.
Zuoyequnxing_52_16,"My frequency loss has been resolved. But Lahai-Roi is under imminent Threnodian threat. I need your help, Shorekeeper."
Zuoyequnxing_52_17,"Understood. For this purpose… both I, and the Black Shores, exist."
Zuoyequnxing_52_18,"Any additional intel on the Exostrider within the Tethys System? Verified or not, I need everything you have."
Zuoyequnxing_52_19,I trust Luuk. You can speak freely.
Zuoyequnxing_52_20,Records confirm that Luuk Herssen has been providing critical assistance and intelligence to the Black Shores. I trust your judgment.
Zuoyequnxing_52_21,"After the founding of Startorch Academy, most information fell under their seal of secrecy. However, in its early days, you mediated negotiations between the Academy and the Roya. Through that process, the Black Shores gained partial access to certain archived insights."
Zuoyequnxing_52_22,"The Spacetrek Collective fears that due to the Exoswarm's division, the Exostrider, even upon awakening, might not have enough power to face the Threnodian. This concern led to the Augmented Resonance initiative—the Synchronists."
Zuoyequnxing_52_23,"Observing how Sentinels work with their Resonators, they theorized that the Exostrider, sharing similarities, could amplify its power through a Resonator as well."
Zuoyequnxing_52_24,"However, considering your link with the Exostrider, the Tethys System does not recommend this method."
Zuoyequnxing_52_25,We have intel that deep beneath Lahai-Roi lies the <te href=851076>Keystone</te> left behind by the Exostrider long ago.
Zuoyequnxing_52_26,It rests directly atop the seal on the <te href=851077>Stridergate</te>. You can think of it as a kind of lock.
Zuoyequnxing_52_27,"You do not need a cockpit to pilot the Exostrider. So long as its activation sequence remains unobstructed, you may pilot it using the Keystone."
Zuoyequnxing_52_28,"...Is it because I'm its ""Arbiter""?"
Zuoyequnxing_52_29,"Precisely. For one who shares its origin, a cockpit would be more of a hindrance."
Zuoyequnxing_52_30,As for Aemeath... I think Dr. Luuk's proposal is viable.
Zuoyequnxing_52_31,"You mean using the Exoswarm-like ""shell"" that appeared in the cockpit to look for her?"
Zuoyequnxing_52_32,"Yes. The connection between frequencies will help. {PlayerName},  bring ""her"" with you when you activate the Exostrider."
Zuoyequnxing_52_33,"Sure. While I'm there, the Black Shores will need to keep a closer eye on Lahai-Roi."
Zuoyequnxing_52_34,I understand.
Zuoyequnxing_52_35,"...I'm counting on you, Shorekeeper."
Zuoyequnxing_52_36,"As long as I may be of help to you, I am… content."
Zuoyequnxing_52_37,"Please return safely from the Stridergate, {PlayerName}."
Zuoyequnxing_52_38,I will. Don't worry.
Zuoyequnxing_52_39,I'll inform Lucilla. Take your time finishing that drink before you head out.
Zuoyequnxing_52_40,"What do you think? I'm about to ask a man to sign off on a crazy plan, and I can't even promise him it'll work."
Zuoyequnxing_52_41,"Nobody has a plan they promise will work. If Chase agrees, it's because he's betting that you're his best option. Just take the win."
Zuoyequnxing_52_42,"At the end of the day, it all comes down to the person, {PlayerName}."
Zuoyequnxing_52_43,"Luuk tells you about unusual Voidmatter activity near the Stridergate, an opportunity that can be used to persuade the Spacetrek Collective of the necessity of your plan. To make preparations, you contact Shorekeeper from Luuk's private workspace, who, with the help of the Tethys System, informs you that you can pilot the Exostrider by activating the underground ""Keystone.""
Shorekeeper also notes that Aemeath's ""shell"" likely connects to her frequency beyond Stridergate. She suggests that you bring ""Aemeath"" with you when you go."
Zuoyequnxing_53_1,I believe Dr. Luuk has already briefed you about the meeting with the Spacetrek Collective's head.
Zuoyequnxing_53_2,Come to Academic Affairs. He's waiting for you there.
Zuoyequnxing_54_1,"Mr. Chase. This is the student I mentioned, {PlayerName}. Our best hope for piloting the Exostrider."
Zuoyequnxing_54_2,"Save the intro, President Lucilla. We've met before."
Zuoyequnxing_54_3,(Before…? In my past life at the Academy?)
Zuoyequnxing_54_4,Let's just get down to it. The Threnodian Aleph-1 situation is deteriorating. We're running out of time.
Zuoyequnxing_54_5,"I wanted to wait for the Exostrider's self-regeneration to finish, but the clock has run out on that one."
Zuoyequnxing_54_6,"So tell me, {PlayerName}. Why do you want to pilot the Exostrider? What's the play?"
Zuoyequnxing_54_7,To find Aemeath and put down the Threnodian.
Zuoyequnxing_54_8,Aemeath… Name rings a bell. The one with the high-sync rate. Her disappearance was a real loss for us.
Zuoyequnxing_54_9,She's beyond the Stridergate.
Zuoyequnxing_54_10,...Hehe. I see how it is.
Zuoyequnxing_54_11,But finding one person in a goddamn interdimensional haystack? Not so easy. You understand our position... the Threnodian is our priority.
Zuoyequnxing_54_12,Stopping the Threnodian is my priority too. I'm gonna handle both.
Zuoyequnxing_54_13,"Look, we have the same objective, so like you said let's ""just get down to it."" If Voidmatter erupts, Lahai-Roi is ground zero. Every one of your projects will take a hit."
Zuoyequnxing_54_14,"Regarding Aleph-1, our intel is insufficient. We are not, at this time, considering its total destruction."
Zuoyequnxing_54_15,What we need is for the Exostrider to reinforce the seal on the Stridergate.
Zuoyequnxing_54_16,"To do that, we need a qualified Synchronist. And we need the Institute's Drive Replica. When that gets embedded in the Exostrider's chest cavity, then its repair is complete."
Zuoyequnxing_54_17,"Right now, the Replica is in its final phase of development. We're still missing critical data."
Zuoyequnxing_54_18,A Drive Replica... Is that what you're building from the fallen Reactor Drive after Helios was launched?
Zuoyequnxing_54_19,"Heh, correct. It's based on the original Drive's framework. You had a hand to play in that. You made sure Helios got launched."
Zuoyequnxing_54_20,"To complete the Drive Replica, we require precise data from the Exostrider operating in high concentrations of Voidmatter, and environmental readings from inside the Threnodian."
Zuoyequnxing_54_21,"Without them, we can't guarantee the Exostrider can resist Aleph-1's corruption."
Zuoyequnxing_54_22,"Here's the verdict, {PlayerName}. On behalf of the Spacetrek Collective, I authorize you to pilot the Exostrider."
Zuoyequnxing_54_23,"But remember, our objective is the data. We need readings from the high-concentration zone to complete the Replica."
Zuoyequnxing_54_24,And your personal mission gets ten minutes. That's the max duration our Voidmatter Barriers can cover the Stridergate once it's opened.
Zuoyequnxing_54_25,"After ten minutes, you return to Lahai-Roi. Whether you found Aemeath or not. Do you accept?"
Zuoyequnxing_54_26,Deal. One more thing. I won't be using a cockpit. Just show me the way to the Keystone and have the Exostrider ready. That's all I need.
Zuoyequnxing_54_27,Heh. Still full of surprises. Always bringing us the... unconventional.
Zuoyequnxing_54_28,"Lucilla, run a high-pressure sync test for {PlayerName}. I've seen the physical eval, but I want live data for validation."
Zuoyequnxing_54_29,"The moment the numbers hit green, we'll begin preparations for activating the Keystone and deploy Voidmatter Barriers around the Stridergate."
Zuoyequnxing_54_30,There's something else. I need a favor.
Zuoyequnxing_54_31,"Go on, {PlayerName}."
Zuoyequnxing_54_32,"The Fractsidus is lying low. Even after failing in the Dark Side, they could move the moment the Stridergate opens."
Zuoyequnxing_54_33,"Ah. That's what's on your mind. Well, I have an update. Remember Sigrika's friend? The… somewhat lackadaisical one?"
Zuoyequnxing_54_34,You mean Denia?
Zuoyequnxing_54_35,That's the one. She's gone missing. Our investigation points to her being the agent the Grand Architect referred to.
Zuoyequnxing_54_36,But don't let it distract you. I have a reliable friend keeping an eye on Fractsidus activity.
Zuoyequnxing_54_37,"You just focus on waking the giant. Leave the rest to us, {PlayerName}."
Zuoyequnxing_54_38,"The Black Shores just sent a formal communication request. They're offering full support for Lahai-Roi's evacuation, if it comes to that."
Zuoyequnxing_54_39,"You handle it, Lucilla. You have a better read on the situation than I do. And you're better at talking with that {PlayerName}."
Zuoyequnxing_54_40,"Heh... If there's anything else you want to ask me, now's the time."
Zuoyequnxing_54_41,"I'm surprised you're placing this much trust in {PlayerName}, authorizing {Male=him;Female=her} so readily. Any particular reason?"
Zuoyequnxing_54_42,"We're different, President. I'm a businessman. And businessmen trust their instincts for a good investment."
Zuoyequnxing_54_43,"The Threnodian could strike at any time. Given the circumstances, Lahai-Roi may have to be written off."
Zuoyequnxing_54_44,"And with the timeline we have, relocating the Exostrider is impossible. If we're going to lose it anyway, why not let {PlayerName} take one last swing?"
Zuoyequnxing_54_45,Understood. We still need to prepare for the worst-case scenario.
Zuoyequnxing_54_46,"Of course. If this fails, we'll initiate the backup plan—Duskveil."
Zuoyequnxing_54_47,"Lucilla introduces you to Chase. The shrewd old man states plainly that he is more concerned with the Drive Replica's development, and hopes it will give the Exostrider the capability to reinforce the seal on the Stridergate. If you pass the Synchronist Test, he agrees to let you pilot the Exostrider. But you are only given ten minutes to achieve your personal goal of finding Aemeath.
After you leave, Chase remarks to Lucilla that the Black Shores already submitted an offer for assistance. The decision to trust you was based on a businessman's eye for opportunity. But if you fail, the Spacetrek Collective will abandon the Exostrider and initiate ""Duskveil."""
Zuoyequnxing_55_1,"Ugh, that guy gives me the creeps..."
Zuoyequnxing_55_2,"What kind of place is the New Federation, anyway? Are they all gonna be like that?"
Zuoyequnxing_55_3,"We'll find out when we get there, Abby."
Zuoyequnxing_56_1,"So, you're {PlayerName}, huh? I'm Sakya. I'll be overseeing and evaluating your test today."
Zuoyequnxing_56_2,Lucilla filled me in on everything.
Zuoyequnxing_56_3,This synchronization test is far more intense than the standard procedure. We're simulating the neural load of a direct link with the Exostrider.
Zuoyequnxing_56_4,"If you feel anything off, you call it. I won't allow the test to continue under Overclocking conditions. Review and confirm the safety protocols before entering the cockpit."
Zuoyequnxing_56_5,(Read and confirm the safety protocols.)
Zuoyequnxing_56_6,Good. The cabin systems are configured. The simulator cockpit is right there. I'll be watching your metrics closely the whole time.
Zuoyequnxing_56_7,I hope... you pass the test smoothly.
Zuoyequnxing_57_1,Neural network connected. Tactical model constructed.
Zuoyequnxing_57_2,Resonator vital signs... synchronized.
Zuoyequnxing_58_1,Neural load rate: fluctuations within normal range. Optimizing model... Ratio adjustment complete.
Zuoyequnxing_58_2,User status stable. No Overclocking detected.
Zuoyequnxing_59_1,Firepower threshold limit removed.
Zuoyequnxing_59_2,Energy output: Stable. Mech compatibility: High.
Zuoyequnxing_60_1,Test complete. Recording synchronization rate data.
Zuoyequnxing_60_2,Cockpit opening. Please exit according to the safety protocols.
Zuoyequnxing_61_1,...How did you get all the way here from the lake house?
Zuoyequnxing_61_2,"She wanders into the Academy sometimes. Usually, her caretaker bot escorts her back pretty quick, but today she was… being difficult."
Zuoyequnxing_61_3,"We'll go back together in a bit, okay?"
Zuoyequnxing_61_4,...
Zuoyequnxing_61_5,Hmph... So the little terror can be quiet. Never thought I'd see the day.
Zuoyequnxing_61_6,"Professor Sakya, you knew Aemeath?"
Zuoyequnxing_61_7,(I think I've heard this Professor's name before...)
Zuoyequnxing_61_8,Yes. I was her teacher. Over ten years ago now. She used to drive me up the wall. Made me lose my composure more than once. She never did seem to mind.
Zuoyequnxing_61_9,(Back at the fan meeting… people mentioned a Sakya. They said she was Aemeath's teacher. That she actually really cared.)
Zuoyequnxing_61_10,"The last day I taught her, she wrote ""Saving the world"" as her career path. I asked her if that was really what a Synchronist should be aiming for, then gave her a piece of my mind and told her to rewrite it."
Zuoyequnxing_61_11,"She didn't even get upset. Just smiled, took the form, and walked away. She never stepped out of that cockpit again."
Zuoyequnxing_61_12,"Now she's back, but not really. What a headache of a student."
Zuoyequnxing_61_13,...
Zuoyequnxing_61_14,Lucilla told me you're her family. Is that true?
Zuoyequnxing_61_15,Yes.
Zuoyequnxing_61_16,And you're planning to pilot the Exostrider and bring her back from the Stridergate?
Zuoyequnxing_61_17,That's the plan.
Zuoyequnxing_61_18,"Sounds like an absurd, bold, utterly delusional idea. No one knows what's actually behind that Gate."
Zuoyequnxing_61_19,I know.
Zuoyequnxing_61_20,"...When Aemeath went missing, the cockpit recorded an abnormally high synchronization rate. We couldn't verify it after she disappeared, so it was never officially logged."
Zuoyequnxing_61_21,"Your test results are just shy of hers overall. But in some sectors, they're even higher. You've passed, {PlayerName}."
Zuoyequnxing_61_22,I hope that absurd plan of yours works… and that you bring my student home.
Zuoyequnxing_61_23,No doubt about it.
Zuoyequnxing_61_24,...I'll do my best.
Zuoyequnxing_61_25,"The results are out, but preparing the Exostrider will take time. You'll need to wait around two days."
Zuoyequnxing_61_26,We'll let you know when it's ready.
Zuoyequnxing_61_27,...Cas...sette...
